,Email_ID,Subject,Body,Category,Cleaned_Subject,Cleaned_Body,combined_text
92,83,Your Recent Purchase Confirmation,Thank you for your recent purchase. Here is the confirmation.,Important,"['your', 'recent', 'purchase', 'confirmation']","['thank', 'you', 'for', 'your', 'recent', 'purchase', 'here', 'is', 'the', 'confirmation']",your recent purchase confirmation thank you for your recent purchase here is the confirmation
93,84,Exclusive Online Event Invitation,You are invited to an exclusive online event next week!,Spam,"['exclusive', 'online', 'event', 'invitation']","['you', 'are', 'invited', 'to', 'an', 'exclusive', 'online', 'event', 'next', 'week']",exclusive online event invitation you are invited to an exclusive online event next week
94,85,Account Security Update,We have updated the security settings for your account.,Important,"['account', 'security', 'update']","['we', 'have', 'updated', 'the', 'security', 'settings', 'for', 'your', 'account']",account security update we have updated the security settings for your account
95,86,Special Promotion on Apparel,Save up to 40% on all apparel items during our special promotion!,Spam,"['special', 'promotion', 'on', 'apparel']","['save', 'up', 'to', 'on', 'all', 'apparel', 'items', 'during', 'our', 'special', 'promotion']",special promotion on apparel save up to on all apparel items during our special promotion
96,87,Client Feedback Request,We would appreciate your feedback on our recent service.,Important,"['client', 'feedback', 'request']","['we', 'would', 'appreciate', 'your', 'feedback', 'on', 'our', 'recent', 'service']",client feedback request we would appreciate your feedback on our recent service
97,88,Flash Sale on Electronics,Don’t miss our flash sale on electronics today only!,Spam,"['flash', 'sale', 'on', 'electronics']","['don’t', 'miss', 'our', 'flash', 'sale', 'on', 'electronics', 'today', 'only']",flash sale on electronics don’t miss our flash sale on electronics today only
98,89,Your Subscription Confirmation,Your subscription has been confirmed. Thank you!,Important,"['your', 'subscription', 'confirmation']","['your', 'subscription', 'has', 'been', 'confirmed', 'thank', 'you']",your subscription confirmation your subscription has been confirmed thank you
99,90,New Product Offer,Discover our new product and enjoy a special introductory offer!,Spam,"['new', 'product', 'offer']","['discover', 'our', 'new', 'product', 'and', 'enjoy', 'a', 'special', 'introductory', 'offer']",new product offer discover our new product and enjoy a special introductory offer
100,91,Project Status Update,Here is the latest update on the project status.,Important,"['project', 'status', 'update']","['here', 'is', 'the', 'latest', 'update', 'on', 'the', 'project', 'status']",project status update here is the latest update on the project status
101,92,Limited-Time Offer on Membership,Join our membership program now and receive a discount!,Spam,"['limitedtime', 'offer', 'on', 'membership']","['join', 'our', 'membership', 'program', 'now', 'and', 'receive', 'a', 'discount']",limitedtime offer on membership join our membership program now and receive a discount
102,93,Your Order is on the Way,Your order is on its way and will arrive soon.,Important,"['your', 'order', 'is', 'on', 'the', 'way']","['your', 'order', 'is', 'on', 'its', 'way', 'and', 'will', 'arrive', 'soon']",your order is on the way your order is on its way and will arrive soon
103,94,Special Discount for Newsletter Subscribers,Check out the special discount just for our newsletter subscribers!,Spam,"['special', 'discount', 'for', 'newsletter', 'subscribers']","['check', 'out', 'the', 'special', 'discount', 'just', 'for', 'our', 'newsletter', 'subscribers']",special discount for newsletter subscribers check out the special discount just for our newsletter subscribers
104,95,Appointment Confirmation,Your appointment has been confirmed for next Tuesday.,Important,"['appointment', 'confirmation']","['your', 'appointment', 'has', 'been', 'confirmed', 'for', 'next', 'tuesday']",appointment confirmation your appointment has been confirmed for next tuesday
105,96,Exclusive Sale Event,Join our exclusive sale event and save up to 60%!,Spam,"['exclusive', 'sale', 'event']","['join', 'our', 'exclusive', 'sale', 'event', 'and', 'save', 'up', 'to']",exclusive sale event join our exclusive sale event and save up to
106,97,Account Activity Alert,We have detected unusual activity on your account.,Important,"['account', 'activity', 'alert']","['we', 'have', 'detected', 'unusual', 'activity', 'on', 'your', 'account']",account activity alert we have detected unusual activity on your account
107,98,Free Sample of New Product,Get a free sample of our new product by signing up today!,Spam,"['free', 'sample', 'of', 'new', 'product']","['get', 'a', 'free', 'sample', 'of', 'our', 'new', 'product', 'by', 'signing', 'up', 'today']",free sample of new product get a free sample of our new product by signing up today
108,99,Monthly Summary Report,Your monthly summary report is now available.,Important,"['monthly', 'summary', 'report']","['your', 'monthly', 'summary', 'report', 'is', 'now', 'available']",monthly summary report your monthly summary report is now available
109,100,Flash Sale Ends Soon,Our flash sale ends soon. Shop now before it’s too late!,Spam,"['flash', 'sale', 'ends', 'soon']","['our', 'flash', 'sale', 'ends', 'soon', 'shop', 'now', 'before', 'it’s', 'too', 'late']",flash sale ends soon our flash sale ends soon shop now before it’s too late
110,101,Your Purchase Confirmation,Thank you for your recent purchase. Here is your confirmation.,Important,"['your', 'purchase', 'confirmation']","['thank', 'you', 'for', 'your', 'recent', 'purchase', 'here', 'is', 'your', 'confirmation']",your purchase confirmation thank you for your recent purchase here is your confirmation
111,102,Exclusive Member Discounts,As a valued member, enjoy these exclusive discounts!,"['exclusive', 'member', 'discounts']","['as', 'a', 'valued', 'member']",exclusive member discounts as a valued member
112,103,Upcoming Workshop Reminder,Reminder: The workshop is scheduled for this Friday.,Important,"['upcoming', 'workshop', 'reminder']","['reminder', 'the', 'workshop', 'is', 'scheduled', 'for', 'this', 'friday']",upcoming workshop reminder reminder the workshop is scheduled for this friday
113,104,Flash Sale Ends Today,Last chance to take advantage of our flash sale!,Spam,"['flash', 'sale', 'ends', 'today']","['last', 'chance', 'to', 'take', 'advantage', 'of', 'our', 'flash', 'sale']",flash sale ends today last chance to take advantage of our flash sale
114,105,New Feature Announcement,We’ve just released a new feature on our platform.,Important,"['new', 'feature', 'announcement']","['we’ve', 'just', 'released', 'a', 'new', 'feature', 'on', 'our', 'platform']",new feature announcement we’ve just released a new feature on our platform
115,106,Special Offer: 20% Off,Get 20% off on your next purchase with this code.,Spam,"['special', 'offer', 'off']","['get', 'off', 'on', 'your', 'next', 'purchase', 'with', 'this', 'code']",special offer off get off on your next purchase with this code
116,107,Job Interview Scheduled,Your job interview has been scheduled for next week.,Important,"['job', 'interview', 'scheduled']","['your', 'job', 'interview', 'has', 'been', 'scheduled', 'for', 'next', 'week']",job interview scheduled your job interview has been scheduled for next week
117,108,Limited Time Only: Free Shipping,Enjoy free shipping on all orders placed today!,Spam,"['limited', 'time', 'only', 'free', 'shipping']","['enjoy', 'free', 'shipping', 'on', 'all', 'orders', 'placed', 'today']",limited time only free shipping enjoy free shipping on all orders placed today
118,109,Monthly Report Ready,The monthly report is ready for your review.,Important,"['monthly', 'report', 'ready']","['the', 'monthly', 'report', 'is', 'ready', 'for', 'your', 'review']",monthly report ready the monthly report is ready for your review
119,110,Exclusive Online Deal,Shop now and save with our exclusive online deal!,Spam,"['exclusive', 'online', 'deal']","['shop', 'now', 'and', 'save', 'with', 'our', 'exclusive', 'online', 'deal']",exclusive online deal shop now and save with our exclusive online deal
120,111,Your Account Has Been Updated,Your account information has been updated successfully.,Important,"['your', 'account', 'has', 'been', 'updated']","['your', 'account', 'information', 'has', 'been', 'updated', 'successfully']",your account has been updated your account information has been updated successfully
121,112,Win a Gift Card,Enter our contest for a chance to win a $50 gift card!,Spam,"['win', 'a', 'gift', 'card']","['enter', 'our', 'contest', 'for', 'a', 'chance', 'to', 'win', 'a', 'gift', 'card']",win a gift card enter our contest for a chance to win a gift card
122,113,Training Session Confirmation,Your registration for the training session is confirmed.,Important,"['training', 'session', 'confirmation']","['your', 'registration', 'for', 'the', 'training', 'session', 'is', 'confirmed']",training session confirmation your registration for the training session is confirmed
123,114,Seasonal Sale Alert,Don’t miss our seasonal sale with up to 50% off!,Spam,"['seasonal', 'sale', 'alert']","['don’t', 'miss', 'our', 'seasonal', 'sale', 'with', 'up', 'to', 'off']",seasonal sale alert don’t miss our seasonal sale with up to off
124,115,Client Meeting Follow-Up,Following up on our client meeting. Please see the attached notes.,Important,"['client', 'meeting', 'followup']","['following', 'up', 'on', 'our', 'client', 'meeting', 'please', 'see', 'the', 'attached', 'notes']",client meeting followup following up on our client meeting please see the attached notes
125,116,Special Promotion: Buy 1 Get 1 Free,Buy one item and get another free for a limited time!,Spam,"['special', 'promotion', 'buy', 'get', 'free']","['buy', 'one', 'item', 'and', 'get', 'another', 'free', 'for', 'a', 'limited', 'time']",special promotion buy get free buy one item and get another free for a limited time
126,117,Your Subscription Renewal Reminder,Your subscription is up for renewal next month.,Important,"['your', 'subscription', 'renewal', 'reminder']","['your', 'subscription', 'is', 'up', 'for', 'renewal', 'next', 'month']",your subscription renewal reminder your subscription is up for renewal next month
127,118,Exclusive Invitation to VIP Event,You’re invited to our exclusive VIP event next week!,Spam,"['exclusive', 'invitation', 'to', 'vip', 'event']","['you’re', 'invited', 'to', 'our', 'exclusive', 'vip', 'event', 'next', 'week']",exclusive invitation to vip event you’re invited to our exclusive vip event next week
128,119,Your Invoice is Available,Your invoice for the recent transaction is available for download.,Important,"['your', 'invoice', 'is', 'available']","['your', 'invoice', 'for', 'the', 'recent', 'transaction', 'is', 'available', 'for', 'download']",your invoice is available your invoice for the recent transaction is available for download
129,120,Limited Time Discount,Get a 15% discount on all purchases made today!,Spam,"['limited', 'time', 'discount']","['get', 'a', 'discount', 'on', 'all', 'purchases', 'made', 'today']",limited time discount get a discount on all purchases made today
130,121,New Product Launch,We are excited to announce the launch of our new product.,Important,"['new', 'product', 'launch']","['we', 'are', 'excited', 'to', 'announce', 'the', 'launch', 'of', 'our', 'new', 'product']",new product launch we are excited to announce the launch of our new product
131,122,Special Offer for Returning Customers,Enjoy a special offer as a thank you for returning to us!,Spam,"['special', 'offer', 'for', 'returning', 'customers']","['enjoy', 'a', 'special', 'offer', 'as', 'a', 'thank', 'you', 'for', 'returning', 'to', 'us']",special offer for returning customers enjoy a special offer as a thank you for returning to us
132,123,Project Update Notification,Here is the latest update on the ongoing project.,Important,"['project', 'update', 'notification']","['here', 'is', 'the', 'latest', 'update', 'on', 'the', 'ongoing', 'project']",project update notification here is the latest update on the ongoing project
133,124,Free Trial Extension,Your free trial has been extended for another 30 days.,Spam,"['free', 'trial', 'extension']","['your', 'free', 'trial', 'has', 'been', 'extended', 'for', 'another', 'days']",free trial extension your free trial has been extended for another days
134,125,Upcoming Event Reminder,Reminder: The upcoming event is scheduled for next Thursday.,Important,"['upcoming', 'event', 'reminder']","['reminder', 'the', 'upcoming', 'event', 'is', 'scheduled', 'for', 'next', 'thursday']",upcoming event reminder reminder the upcoming event is scheduled for next thursday
135,126,Exclusive Discount on Membership,Get a discount on membership if you join this month!,Spam,"['exclusive', 'discount', 'on', 'membership']","['get', 'a', 'discount', 'on', 'membership', 'if', 'you', 'join', 'this', 'month']",exclusive discount on membership get a discount on membership if you join this month
136,127,Your Order Has Shipped,Your order has been shipped and is on its way.,Important,"['your', 'order', 'has', 'shipped']","['your', 'order', 'has', 'been', 'shipped', 'and', 'is', 'on', 'its', 'way']",your order has shipped your order has been shipped and is on its way
137,128,Seasonal Promotion,Enjoy our seasonal promotion with discounts on all items!,Spam,"['seasonal', 'promotion']","['enjoy', 'our', 'seasonal', 'promotion', 'with', 'discounts', 'on', 'all', 'items']",seasonal promotion enjoy our seasonal promotion with discounts on all items
138,129,Feedback Request,Please provide your feedback on our recent service.,Important,"['feedback', 'request']","['please', 'provide', 'your', 'feedback', 'on', 'our', 'recent', 'service']",feedback request please provide your feedback on our recent service
139,130,Special Sale: 40% Off,Take advantage of our special sale with 40% off on select items!,Spam,"['special', 'sale', 'off']","['take', 'advantage', 'of', 'our', 'special', 'sale', 'with', 'off', 'on', 'select', 'items']",special sale off take advantage of our special sale with off on select items
140,131,Your Support Ticket Update,Your support ticket has been updated. Please check the details.,Important,"['your', 'support', 'ticket', 'update']","['your', 'support', 'ticket', 'has', 'been', 'updated', 'please', 'check', 'the', 'details']",your support ticket update your support ticket has been updated please check the details
141,132,Flash Deal Ending Soon,Our flash deal ends soon. Shop now to save big!,Spam,"['flash', 'deal', 'ending', 'soon']","['our', 'flash', 'deal', 'ends', 'soon', 'shop', 'now', 'to', 'save', 'big']",flash deal ending soon our flash deal ends soon shop now to save big
142,133,Monthly Summary Report,The monthly summary report is ready for your review.,Important,"['monthly', 'summary', 'report']","['the', 'monthly', 'summary', 'report', 'is', 'ready', 'for', 'your', 'review']",monthly summary report the monthly summary report is ready for your review
143,134,Limited-Time Offer: Free Gift,Receive a free gift with your purchase today!,Spam,"['limitedtime', 'offer', 'free', 'gift']","['receive', 'a', 'free', 'gift', 'with', 'your', 'purchase', 'today']",limitedtime offer free gift receive a free gift with your purchase today
144,135,Meeting Confirmation,Your meeting has been confirmed for tomorrow at 2 PM.,Important,"['meeting', 'confirmation']","['your', 'meeting', 'has', 'been', 'confirmed', 'for', 'tomorrow', 'at', 'pm']",meeting confirmation your meeting has been confirmed for tomorrow at pm
145,136,Exclusive Deal for Subscribers,Check out this exclusive deal available only for subscribers!,Spam,"['exclusive', 'deal', 'for', 'subscribers']","['check', 'out', 'this', 'exclusive', 'deal', 'available', 'only', 'for', 'subscribers']",exclusive deal for subscribers check out this exclusive deal available only for subscribers
146,137,Your Payment Confirmation,Your recent payment has been successfully processed.,Important,"['your', 'payment', 'confirmation']","['your', 'recent', 'payment', 'has', 'been', 'successfully', 'processed']",your payment confirmation your recent payment has been successfully processed
147,138,Special Promotion: 30% Off,Enjoy a 30% discount on your next purchase with this promo code.,Spam,"['special', 'promotion', 'off']","['enjoy', 'a', 'discount', 'on', 'your', 'next', 'purchase', 'with', 'this', 'promo', 'code']",special promotion off enjoy a discount on your next purchase with this promo code
148,139,Job Application Update,We have received your job application and will review it soon.,Important,"['job', 'application', 'update']","['we', 'have', 'received', 'your', 'job', 'application', 'and', 'will', 'review', 'it', 'soon']",job application update we have received your job application and will review it soon
149,140,Free Sample Available,Claim your free sample by signing up on our website.,Spam,"['free', 'sample', 'available']","['claim', 'your', 'free', 'sample', 'by', 'signing', 'up', 'on', 'our', 'website']",free sample available claim your free sample by signing up on our website
150,141,Client Feedback Needed,Please provide feedback on the recent client project.,Important,"['client', 'feedback', 'needed']","['please', 'provide', 'feedback', 'on', 'the', 'recent', 'client', 'project']",client feedback needed please provide feedback on the recent client project
151,142,Limited-Time Flash Sale,Don’t miss our limited-time flash sale with discounts on all items!,Spam,"['limitedtime', 'flash', 'sale']","['don’t', 'miss', 'our', 'limitedtime', 'flash', 'sale', 'with', 'discounts', 'on', 'all', 'items']",limitedtime flash sale don’t miss our limitedtime flash sale with discounts on all items
152,143,Your Account Activity Alert,We noticed unusual activity on your account. Please review.,Important,"['your', 'account', 'activity', 'alert']","['we', 'noticed', 'unusual', 'activity', 'on', 'your', 'account', 'please', 'review']",your account activity alert we noticed unusual activity on your account please review
153,144,Special Offer on New Arrivals,Get a discount on our new arrivals for a limited time!,Spam,"['special', 'offer', 'on', 'new', 'arrivals']","['get', 'a', 'discount', 'on', 'our', 'new', 'arrivals', 'for', 'a', 'limited', 'time']",special offer on new arrivals get a discount on our new arrivals for a limited time
154,145,Upcoming Workshop Details,Here are the details for the upcoming workshop.,Important,"['upcoming', 'workshop', 'details']","['here', 'are', 'the', 'details', 'for', 'the', 'upcoming', 'workshop']",upcoming workshop details here are the details for the upcoming workshop
155,146,Exclusive Discount for Members,Enjoy an exclusive discount available only for members!,Spam,"['exclusive', 'discount', 'for', 'members']","['enjoy', 'an', 'exclusive', 'discount', 'available', 'only', 'for', 'members']",exclusive discount for members enjoy an exclusive discount available only for members
156,147,Order Confirmation,Thank you for your order. Your confirmation is attached.,Important,"['order', 'confirmation']","['thank', 'you', 'for', 'your', 'order', 'your', 'confirmation', 'is', 'attached']",order confirmation thank you for your order your confirmation is attached
157,148,Seasonal Sale Announcement,Our seasonal sale starts today with up to 50% off!,Spam,"['seasonal', 'sale', 'announcement']","['our', 'seasonal', 'sale', 'starts', 'today', 'with', 'up', 'to', 'off']",seasonal sale announcement our seasonal sale starts today with up to off
158,149,Feedback Survey Invitation,We invite you to take part in our feedback survey.,Important,"['feedback', 'survey', 'invitation']","['we', 'invite', 'you', 'to', 'take', 'part', 'in', 'our', 'feedback', 'survey']",feedback survey invitation we invite you to take part in our feedback survey
159,150,Flash Sale Today,Shop our flash sale today and save up to 60%!,Spam,"['flash', 'sale', 'today']","['shop', 'our', 'flash', 'sale', 'today', 'and', 'save', 'up', 'to']",flash sale today shop our flash sale today and save up to
160,151,Your Subscription Status,Your subscription status has been updated.,Important,"['your', 'subscription', 'status']","['your', 'subscription', 'status', 'has', 'been', 'updated']",your subscription status your subscription status has been updated
161,152,Special Offer for New Customers,New customers receive a special offer on their first purchase!,Spam,"['special', 'offer', 'for', 'new', 'customers']","['new', 'customers', 'receive', 'a', 'special', 'offer', 'on', 'their', 'first', 'purchase']",special offer for new customers new customers receive a special offer on their first purchase
162,153,Project Deadline Reminder,Reminder: The project deadline is approaching.,Important,"['project', 'deadline', 'reminder']","['reminder', 'the', 'project', 'deadline', 'is', 'approaching']",project deadline reminder reminder the project deadline is approaching
163,154,Limited-Time Discount Code,Use this discount code for a limited-time offer.,Spam,"['limitedtime', 'discount', 'code']","['use', 'this', 'discount', 'code', 'for', 'a', 'limitedtime', 'offer']",limitedtime discount code use this discount code for a limitedtime offer
164,155,Upcoming Event Confirmation,Your registration for the upcoming event is confirmed.,Important,"['upcoming', 'event', 'confirmation']","['your', 'registration', 'for', 'the', 'upcoming', 'event', 'is', 'confirmed']",upcoming event confirmation your registration for the upcoming event is confirmed
165,156,Exclusive Online Discount,Enjoy an exclusive discount available only online!,Spam,"['exclusive', 'online', 'discount']","['enjoy', 'an', 'exclusive', 'discount', 'available', 'only', 'online']",exclusive online discount enjoy an exclusive discount available only online
166,157,Your Invoice Update,Your invoice has been updated. Please review the changes.,Important,"['your', 'invoice', 'update']","['your', 'invoice', 'has', 'been', 'updated', 'please', 'review', 'the', 'changes']",your invoice update your invoice has been updated please review the changes
167,158,Special Sale on Electronics,Save on electronics during our special sale event!,Spam,"['special', 'sale', 'on', 'electronics']","['save', 'on', 'electronics', 'during', 'our', 'special', 'sale', 'event']",special sale on electronics save on electronics during our special sale event
168,159,Client Meeting Reminder,Reminder: You have a client meeting scheduled for tomorrow.,Important,"['client', 'meeting', 'reminder']","['reminder', 'you', 'have', 'a', 'client', 'meeting', 'scheduled', 'for', 'tomorrow']",client meeting reminder reminder you have a client meeting scheduled for tomorrow
169,160,Seasonal Promotion Announcement,Our seasonal promotion is here with great discounts!,Spam,"['seasonal', 'promotion', 'announcement']","['our', 'seasonal', 'promotion', 'is', 'here', 'with', 'great', 'discounts']",seasonal promotion announcement our seasonal promotion is here with great discounts
170,161,Your Recent Order Confirmation,Here is the confirmation for your recent order.,Important,"['your', 'recent', 'order', 'confirmation']","['here', 'is', 'the', 'confirmation', 'for', 'your', 'recent', 'order']",your recent order confirmation here is the confirmation for your recent order
171,162,Free Gift with Subscription,Subscribe now and receive a free gift!,Spam,"['free', 'gift', 'with', 'subscription']","['subscribe', 'now', 'and', 'receive', 'a', 'free', 'gift']",free gift with subscription subscribe now and receive a free gift
172,163,Job Interview Confirmation,Your job interview has been confirmed for next week.,Important,"['job', 'interview', 'confirmation']","['your', 'job', 'interview', 'has', 'been', 'confirmed', 'for', 'next', 'week']",job interview confirmation your job interview has been confirmed for next week
173,164,Exclusive Offer for Returning Customers,Returning customers get an exclusive offer just for you!,Spam,"['exclusive', 'offer', 'for', 'returning', 'customers']","['returning', 'customers', 'get', 'an', 'exclusive', 'offer', 'just', 'for', 'you']",exclusive offer for returning customers returning customers get an exclusive offer just for you
174,165,Monthly Performance Review,Your monthly performance review is now available.,Important,"['monthly', 'performance', 'review']","['your', 'monthly', 'performance', 'review', 'is', 'now', 'available']",monthly performance review your monthly performance review is now available
175,166,Limited-Time Flash Deal,Our flash deal ends soon. Don’t miss out!,Spam,"['limitedtime', 'flash', 'deal']","['our', 'flash', 'deal', 'ends', 'soon', 'don’t', 'miss', 'out']",limitedtime flash deal our flash deal ends soon don’t miss out
176,167,New Product Offer,Check out our new product and enjoy a special offer!,Important,"['new', 'product', 'offer']","['check', 'out', 'our', 'new', 'product', 'and', 'enjoy', 'a', 'special', 'offer']",new product offer check out our new product and enjoy a special offer
177,168,Special Discount for Subscribers,Subscribers receive a special discount on all orders!,Spam,"['special', 'discount', 'for', 'subscribers']","['subscribers', 'receive', 'a', 'special', 'discount', 'on', 'all', 'orders']",special discount for subscribers subscribers receive a special discount on all orders
178,169,Your Order Status,Your order status has been updated. Check your account for details.,Important,"['your', 'order', 'status']","['your', 'order', 'status', 'has', 'been', 'updated', 'check', 'your', 'account', 'for', 'details']",your order status your order status has been updated check your account for details
