,Email_ID,Subject,Body,Category,Cleaned_Subject,Cleaned_Body,combined_text
179,170,Seasonal Sale Alert,Our seasonal sale is live with huge discounts!,Spam,"['seasonal', 'sale', 'alert']","['our', 'seasonal', 'sale', 'is', 'live', 'with', 'huge', 'discounts']",seasonal sale alert our seasonal sale is live with huge discounts
180,171,Client Feedback Request,We need your feedback on our recent client project.,Important,"['client', 'feedback', 'request']","['we', 'need', 'your', 'feedback', 'on', 'our', 'recent', 'client', 'project']",client feedback request we need your feedback on our recent client project
181,172,Flash Sale Ending Soon,Our flash sale is ending soon. Shop now to save!,Spam,"['flash', 'sale', 'ending', 'soon']","['our', 'flash', 'sale', 'is', 'ending', 'soon', 'shop', 'now', 'to', 'save']",flash sale ending soon our flash sale is ending soon shop now to save
182,173,Subscription Renewal Reminder,Reminder: Your subscription will renew next month.,Important,"['subscription', 'renewal', 'reminder']","['reminder', 'your', 'subscription', 'will', 'renew', 'next', 'month']",subscription renewal reminder reminder your subscription will renew next month
183,174,Exclusive VIP Sale,Join our exclusive VIP sale event and save big!,Spam,"['exclusive', 'vip', 'sale']","['join', 'our', 'exclusive', 'vip', 'sale', 'event', 'and', 'save', 'big']",exclusive vip sale join our exclusive vip sale event and save big
184,175,Your Purchase Receipt,Here is the receipt for your recent purchase.,Important,"['your', 'purchase', 'receipt']","['here', 'is', 'the', 'receipt', 'for', 'your', 'recent', 'purchase']",your purchase receipt here is the receipt for your recent purchase
185,176,Special Offer: Buy 2 Get 1 Free,Buy two items and get one free for a limited time!,Spam,"['special', 'offer', 'buy', 'get', 'free']","['buy', 'two', 'items', 'and', 'get', 'one', 'free', 'for', 'a', 'limited', 'time']",special offer buy get free buy two items and get one free for a limited time
186,177,Upcoming Workshop Reminder,Reminder: The workshop is happening this Saturday.,Important,"['upcoming', 'workshop', 'reminder']","['reminder', 'the', 'workshop', 'is', 'happening', 'this', 'saturday']",upcoming workshop reminder reminder the workshop is happening this saturday
187,178,Limited-Time Online Offer,Take advantage of our limited-time online offer!,Spam,"['limitedtime', 'online', 'offer']","['take', 'advantage', 'of', 'our', 'limitedtime', 'online', 'offer']",limitedtime online offer take advantage of our limitedtime online offer
188,179,Monthly Account Update,Your monthly account update is ready for review.,Important,"['monthly', 'account', 'update']","['your', 'monthly', 'account', 'update', 'is', 'ready', 'for', 'review']",monthly account update your monthly account update is ready for review
189,180,Special Promotion for Subscribers,Subscribers get an exclusive promotion on all orders!,Spam,"['special', 'promotion', 'for', 'subscribers']","['subscribers', 'get', 'an', 'exclusive', 'promotion', 'on', 'all', 'orders']",special promotion for subscribers subscribers get an exclusive promotion on all orders
190,181,Your Invoice is Ready,Your invoice is available for download.,Important,"['your', 'invoice', 'is', 'ready']","['your', 'invoice', 'is', 'available', 'for', 'download']",your invoice is ready your invoice is available for download
191,182,Exclusive Online Event,You’re invited to our exclusive online event next week!,Spam,"['exclusive', 'online', 'event']","['you’re', 'invited', 'to', 'our', 'exclusive', 'online', 'event', 'next', 'week']",exclusive online event you’re invited to our exclusive online event next week
192,183,Client Meeting Follow-Up,Following up on our recent client meeting. Please review.,Important,"['client', 'meeting', 'followup']","['following', 'up', 'on', 'our', 'recent', 'client', 'meeting', 'please', 'review']",client meeting followup following up on our recent client meeting please review
193,184,Special Discount for Members,Members get a special discount on their next purchase!,Spam,"['special', 'discount', 'for', 'members']","['members', 'get', 'a', 'special', 'discount', 'on', 'their', 'next', 'purchase']",special discount for members members get a special discount on their next purchase
194,185,Order Confirmation,Your order has been confirmed. Thank you for shopping with us.,Important,"['order', 'confirmation']","['your', 'order', 'has', 'been', 'confirmed', 'thank', 'you', 'for', 'shopping', 'with', 'us']",order confirmation your order has been confirmed thank you for shopping with us
195,186,Seasonal Sale Notification,Our seasonal sale starts now with great discounts!,Spam,"['seasonal', 'sale', 'notification']","['our', 'seasonal', 'sale', 'starts', 'now', 'with', 'great', 'discounts']",seasonal sale notification our seasonal sale starts now with great discounts
196,187,Feedback Request,We value your feedback on our recent service.,Important,"['feedback', 'request']","['we', 'value', 'your', 'feedback', 'on', 'our', 'recent', 'service']",feedback request we value your feedback on our recent service
197,188,Flash Sale Today,Shop our flash sale today and get up to 70% off!,Spam,"['flash', 'sale', 'today']","['shop', 'our', 'flash', 'sale', 'today', 'and', 'get', 'up', 'to', 'off']",flash sale today shop our flash sale today and get up to off
198,189,Your Subscription Status Update,Your subscription status has been updated.,Important,"['your', 'subscription', 'status', 'update']","['your', 'subscription', 'status', 'has', 'been', 'updated']",your subscription status update your subscription status has been updated
199,190,Exclusive Offer for New Subscribers,New subscribers receive an exclusive offer on their first order!,Spam,"['exclusive', 'offer', 'for', 'new', 'subscribers']","['new', 'subscribers', 'receive', 'an', 'exclusive', 'offer', 'on', 'their', 'first', 'order']",exclusive offer for new subscribers new subscribers receive an exclusive offer on their first order
200,191,Job Application Status,We have reviewed your application and will contact you soon.,Important,"['job', 'application', 'status']","['we', 'have', 'reviewed', 'your', 'application', 'and', 'will', 'contact', 'you', 'soon']",job application status we have reviewed your application and will contact you soon
201,192,Free Sample Offer,Get a free sample by signing up on our website.,Spam,"['free', 'sample', 'offer']","['get', 'a', 'free', 'sample', 'by', 'signing', 'up', 'on', 'our', 'website']",free sample offer get a free sample by signing up on our website
202,193,Client Feedback Needed,Please provide your feedback on our recent service.,Important,"['client', 'feedback', 'needed']","['please', 'provide', 'your', 'feedback', 'on', 'our', 'recent', 'service']",client feedback needed please provide your feedback on our recent service
203,194,Limited-Time Flash Sale,Don’t miss out on our limited-time flash sale!,Spam,"['limitedtime', 'flash', 'sale']","['don’t', 'miss', 'out', 'on', 'our', 'limitedtime', 'flash', 'sale']",limitedtime flash sale don’t miss out on our limitedtime flash sale
204,195,Your Account Activity Report,Your account activity report is available for review.,Important,"['your', 'account', 'activity', 'report']","['your', 'account', 'activity', 'report', 'is', 'available', 'for', 'review']",your account activity report your account activity report is available for review
205,196,Special Discount on New Products,Get a discount on our new products for a limited time!,Spam,"['special', 'discount', 'on', 'new', 'products']","['get', 'a', 'discount', 'on', 'our', 'new', 'products', 'for', 'a', 'limited', 'time']",special discount on new products get a discount on our new products for a limited time
206,197,Upcoming Workshop Details,Details for the upcoming workshop are now available.,Important,"['upcoming', 'workshop', 'details']","['details', 'for', 'the', 'upcoming', 'workshop', 'are', 'now', 'available']",upcoming workshop details details for the upcoming workshop are now available
207,198,Exclusive Member Sale,Enjoy an exclusive sale available only to members!,Spam,"['exclusive', 'member', 'sale']","['enjoy', 'an', 'exclusive', 'sale', 'available', 'only', 'to', 'members']",exclusive member sale enjoy an exclusive sale available only to members
208,199,Order Confirmation,Your order confirmation is attached. Thank you!,Important,"['order', 'confirmation']","['your', 'order', 'confirmation', 'is', 'attached', 'thank', 'you']",order confirmation your order confirmation is attached thank you
209,200,Seasonal Sale Announcement,Our seasonal sale starts today with up to 50% off!,Spam,"['seasonal', 'sale', 'announcement']","['our', 'seasonal', 'sale', 'starts', 'today', 'with', 'up', 'to', 'off']",seasonal sale announcement our seasonal sale starts today with up to off
